<?xml version="1.0" encoding="UTF-8" ?>
<?xml-stylesheet type="text/xsl" href="Lua.xsl"?>

<Lua xmlns='http://www.stepmania.com' xmlns:xsi='http://www.w3.org/2001/XMLSchema-instance' xsi:schemaLocation='http://www.stepmania.com Lua.xsd'>
	<GlobalFunctions>
		<Function name='AllowOptionsMenu'/>
		<Function name='Alpha'/>
		<Function name='ArbitrarySpeedMods'/>
		<Function name='AreStagePlayerModsForced'/>
		<Function name='AreStageSongModsForced'/>
		<Function name='ArgsIfPlayerJoinedOrNil'/>
		<Function name='BGFitChoiceExample'/>
		<Function name='BGFitInputActor'/>
		<Function name='BackgroundType'/>
		<Function name='Basename'/>
		<Function name='BoostColor'/>
		<Function name='Brightness'/>
		<Function name='ByMSD'/>
		<Function name='ByMusicLength'/>
		<Function name='Center1Player'/>
		<Function name='ChangeMusicRate'/>
		<Function name='CloseConnection'/>
		<Function name='ColorDarkTone'/>
		<Function name='ColorLightTone'/>
		<Function name='ColorMidTone'/>
		<Function name='ColorToHSV'/>
		<Function name='ColorToHex'/>
		<Function name='ComboContinue'/>
		<Function name='ComboMaintain'/>
		<Function name='ComboPerRow'/>
		<Function name='ComboTransformCommand'/>
		<Function name='ConnectToServer'/>
		<Function name='CustomDifficultyToColor'/>
		<Function name='CustomDifficultyToDarkColor'/>
		<Function name='CustomDifficultyToLightColor'/>
		<Function name='CustomDifficultyToLocalizedString'/>
		<Function name='CustomizeGameplay'/>
		<Function name='DayOfMonth'/>
		<Function name='DayOfYear'/>
		<Function name='DeepCopy'/>
		<Function name='DefaultScoreType'/>
		<Function name='DisplayPercent'/>
		<Function name='ErrorBar'/>
		<Function name='EvalBGType'/>
		<Function name='EvalUsesCheckpointsWithJudgments'/>
		<Function name='FadeIn'/>
		<Function name='FailCombo'/>
		<Function name='FindSelection'/>
		<Function name='FindValue'/>
		<Function name='FormatNumSongsPlayed'/>
		<Function name='FormatNumberAndSuffix'/>
		<Function name='FormatPercentScore'/>
		<Function name='FullProgressBar'/>
		<Function name='GameCompatibleModes'/>
		<Function name='GameOverOrContinue'/>
		<Function name='GameplayMargins'/>
		<Function name='GetCodeForGame'/>
		<Function name='GetCoursesToShowRanking'/>
		<Function name='GetCustomDifficulty'/>
		<Function name='GetDefaultOptionLines'/>
		<Function name='GetEditModeSubScreens'/>
		<Function name='GetExtraColorThreshold'/>
		<Function name='GetGamePref'/>
		<Function name='GetGamePrefB'/>
		<Function name='GetGamePrefC'/>
		<Function name='GetGamePrefN'/>
		<Function name='GetGradeFromPercent'/>
		<Function name='GetLifeDifficulty'/>
		<Function name='GetPlayableTime'/>
		<Function name='GetPlayerOrMachineProfile'/>
		<Function name='GetProTiming'/>
		<Function name='GetRandomSongBackground'/>
		<Function name='GetReal'/>
		<Function name='GetRealInverse'/>
		<Function name='GetScreenAspectRatio'/>
		<Function name='GetServerName'/>
		<Function name='GetSongBackground'/>
		<Function name='GetSpeedModeAndValueFromPoptions'/>
		<Function name='GetThemeAspectRatio'/>
		<Function name='GetThemePref'/>
		<Function name='GetTimeSinceStart'/>
		<Function name='GetTimingDifficulty'/>
		<Function name='GetTitleSafeH'/>
		<Function name='GetTitleSafeV'/>
		<Function name='GetUserPref'/>
		<Function name='GetUserPrefB'/>
		<Function name='GetUserPrefC'/>
		<Function name='GetUserPrefN'/>
		<Function name='HSV'/>
		<Function name='HSVA'/>
		<Function name='HSVToColor'/>
		<Function name='HSVToHex'/>
		<Function name='HasAlpha'/>
		<Function name='HelpMenu'/>
		<Function name='HitCombo'/>
		<Function name='HoldTiming'/>
		<Function name='Hour'/>
		<Function name='Hue'/>
		<Function name='IndexOf'/>
		<Function name='InitGamePrefs'/>
		<Function name='InitUserPrefs'/>
		<Function name='IsArcade'/>
		<Function name='IsCourse'/>
		<Function name='IsFreePlay'/>
		<Function name='IsGame'/>
		<Function name='IsHome'/>
		<Function name='IsNetConnected'/>
		<Function name='IsNetSMOnline'/>
		<Function name='IsRoutine'/>
		<Function name='IsSMOnlineLoggedIn'/>
		<Function name='IsUsingWideScreen'/>
		<Function name='JudgeCounter'/>
		<Function name='JudgmentLineToColor'/>
		<Function name='JudgmentLineToLocalizedString'/>
		<Function name='JudgmentLineToStrokeColor'/>
		<Function name='JudgmentText'/>
		<Function name='JudgmentTransformCommand'/>
		<Function name='JudgmentTransformSharedCommand'/>
		<Function name='LaneCover'/>
		<Function name='LoadActor'/>
		<Function name='LoadActorFunc'/>
		<Function name='LoadActorWithParams'/>
		<Function name='LoadFallbackB'/>
		<Function name='LoadFont'/>
		<Function name='LoadProfileCustom'/>
		<Function name='LoadSongBackground'/>
		<Function name='LocalizeOptionItem'/>
		<Function name='MD5FileHex'/>
		<Function name='MD5StringHex'/>
		<Function name='MeasureLines'/>
		<Function name='MiniProgressBar'/>
		<Function name='Minute'/>
		<Function name='MissCombo'/>
		<Function name='MonthOfYear'/>
		<Function name='MonthToLocalizedString'/>
		<Function name='MonthToString'/>
		<Function name='MultiPlayerToLocalizedString'/>
		<Function name='MultiPlayerToString'/>
		<Function name='NPSDisplay'/>
		<Function name='NPSWindow'/>
		<Function name='OldStyleStringToDifficulty'/>
		<Function name='OptionRowProTiming'/>
		<Function name='OptionRowScreenFilter'/>
		<Function name='OptionsNavigationMode'/>
		<Function name='OptionsRandomJukebox'/>
		<Function name='OptionsRowTest'/>
		<Function name='OptionsWeight'/>
		<Function name='Particles'/>
		<Function name='PeakComboAwardToLocalizedString'/>
		<Function name='PlayModeToLocalizedString'/>
		<Function name='PlayerColor'/>
		<Function name='PlayerDarkColor'/>
		<Function name='PlayerInfo'/>
		<Function name='PlayerNumberToLocalizedString'/>
		<Function name='PlayerNumberToString'/>
		<Function name='PlayerScoreColor'/>
		<Function name='PositionPerPlayer'/>
		<Function name='PrettyPercent'/>
		<Function name='PrintTable'/>
		<Function name='ProductFamily'/>
		<Function name='ProductID'/>
		<Function name='ProductVersion'/>
		<Function name='ProgressBar'/>
		<Function name='RadarCategoryToLocalizedString'/>
		<Function name='RateSort'/>
		<Function name='ReadGamePrefFromFile'/>
		<Function name='ReadPrefFromFile'/>
		<Function name='ReceptorSize'/>
		<Function name='ReportStyle'/>
		<Function name='ResolveRelativePath'/>
		<Function name='RoutineSkinP1'/>
		<Function name='RoutineSkinP2'/>
		<Function name='SHA1FileHex'/>
		<Function name='SHA1StringHex'/>
		<Function name='SMOnlineScreen'/>
		<Function name='Saturation'/>
		<Function name='SaveProfileCustom'/>
		<Function name='SaveScreenshot'/>
		<Function name='ScoreKeeperClass'/>
		<Function name='ScreenColor'/>
		<Function name='ScreenMetric'/>
		<Function name='ScreenSelectStyleChoices'/>
		<Function name='ScreenSelectStylePositions'/>
		<Function name='ScreenString'/>
		<Function name='Second'/>
		<Function name='SecondsToHHMMSS'/>
		<Function name='SecondsToMMSS'/>
		<Function name='SecondsToMMSSMsMs'/>
		<Function name='SecondsToMMSSMsMsMs'/>
		<Function name='SecondsToMSS'/>
		<Function name='SecondsToMSSMsMs'/>
		<Function name='SelectMusicOrCourse'/>
		<Function name='SelectProfileKeys'/>
		<Function name='Serialize'/>
		<Function name='SetGamePref'/>
		<Function name='SetThemePref'/>
		<Function name='SetUserPref'/>
		<Function name='ShowHoldJudgments'/>
		<Function name='ShowStandardDecoration'/>
		<Function name='SongBGEnabled'/>
		<Function name='SongBGMouseEnabled'/>
		<Function name='SortOrderToLocalizedString'/>
		<Function name='SpeedModIncLarge'/>
		<Function name='SpeedModIncSize'/>
		<Function name='SpeedMods'/>
		<Function name='StageAwardToLocalizedString'/>
		<Function name='StageToColor'/>
		<Function name='StageToLocalizedString'/>
		<Function name='StageToStrokeColor'/>
		<Function name='StandardDecorationFromFile'/>
		<Function name='StandardDecorationFromFileOptional'/>
		<Function name='StandardDecorationFromTable'/>
		<Function name='StepsOrTrailToColor'/>
		<Function name='StepsOrTrailToCustomDifficulty'/>
		<Function name='StepsToCustomDifficulty'/>
		<Function name='StringToBlend'/>
		<Function name='TableStringLookup'/>
		<Function name='TapNoteScoreToLocalizedString'/>
		<Function name='TargetGoal'/>
		<Function name='TargetTracker'/>
		<Function name='TargetTrackerMode'/>
		<Function name='TextBannerAfterSet'/>
		<Function name='ThemePrefRow'/>
		<Function name='TipType'/>
		<Function name='ToEnumShortString'/>
		<Function name='Trace'/>
		<Function name='TwoPartSelection'/>
		<Function name='URLEncode'/>
		<Function name='Var'/>
		<Function name='VersionDate'/>
		<Function name='VersionTime'/>
		<Function name='Warn'/>
		<Function name='Weekday'/>
		<Function name='WideScale'/>
		<Function name='WrapInActorFrame'/>
		<Function name='WriteGamePrefToFile'/>
		<Function name='WritePrefToFile'/>
		<Function name='Year'/>
		<Function name='add_blank_tables_to_params'/>
		<Function name='add_defaults_to_params'/>
		<Function name='alias_one'/>
		<Function name='alias_set'/>
		<Function name='approach'/>
		<Function name='assert'/>
		<Function name='byDifficulty'/>
		<Function name='capWideScale'/>
		<Function name='check_stop_course_early'/>
		<Function name='clamp'/>
		<Function name='class'/>
		<Function name='collectgarbage'/>
		<Function name='color'/>
		<Function name='commify'/>
		<Function name='convert_text_to_indented_lines'/>
		<Function name='convert_xml_bgs'/>
		<Function name='create_bezier'/>
		<Function name='create_setting'/>
		<Function name='create_spline'/>
		<Function name='disqualifyScore'/>
		<Function name='dofile'/>
		<Function name='edit_pick_menu_actor'/>
		<Function name='edit_pick_menu_steps_display_item'/>